{
  "record_schema_version": "myresearcher.encoder-m2-s1-owner-decision-record.v1",
  "authorization_granted": false,
  "owner_decision_id": "NO_OWNER_DECISION_RECORDED",
  "authorized_receipt_content_addresses": [],
  "record_content_address": "5316a85c148928e220593e72b97496fbe2bf85215e65adeebe7e230838e6ed9a"
}
